{
  "schema_version": 1,
  "provider": "github-projects",
  "owner_type": "organization",
  "owner": "YOUR-ORG",
  "project_number": 1,
  "mode": "export-only",
  "item_mode": "draft-issue",
  "publish_statuses": [
    "ready",
    "planned",
    "active",
    "in-progress",
    "validating",
    "at-risk",
    "blocked",
    "completed"
  ],
  "fields": {
    "continuity_id": "Continuity ID",
    "kind": "Kind",
    "status": "Status",
    "health": "Health",
    "priority": "Priority",
    "phase": "Phase",
    "start_date": "Start date",
    "target_date": "Target date",
    "parent_ids": "Parent IDs",
    "depends_on": "Depends on"
  },
  "kind_options": {
    "program": "Program",
    "initiative": "Initiative",
    "release": "Release",
    "milestone": "Milestone",
    "epic": "Epic",
    "story": "Story",
    "bug": "Bug",
    "spike": "Spike",
    "chore": "Chore",
    "sprint": "Sprint"
  },
  "status_options": {
    "proposed": "Backlog",
    "inbox": "Backlog",
    "triaged": "Backlog",
    "ready": "Ready",
    "planned": "Ready",
    "active": "In progress",
    "in-progress": "In progress",
    "validating": "Validating",
    "paused": "Paused",
    "at-risk": "In progress",
    "blocked": "Blocked",
    "completed": "Done",
    "done": "Done",
    "closed": "Done",
    "cancelled": "Cancelled",
    "historical": "Done"
  },
  "health_options": {
    "unknown": "Unknown",
    "on-track": "On track",
    "at-risk": "At risk",
    "off-track": "Off track",
    "blocked": "Blocked",
    "complete": "Complete"
  },
  "priority_options": {
    "critical": "Critical",
    "high": "High",
    "medium": "Medium",
    "low": "Low",
    "p0": "P0",
    "p1": "P1",
    "p2": "P2",
    "p3": "P3",
    "unprioritized": "Unprioritized"
  },
  "phase_options": {
    "proposed": "Discovery",
    "inbox": "Discovery",
    "triaged": "Discovery",
    "ready": "Planning",
    "planned": "Planning",
    "active": "Delivery",
    "in-progress": "Delivery",
    "validating": "Validation",
    "paused": "Paused",
    "at-risk": "Delivery",
    "blocked": "Blocked",
    "completed": "Complete",
    "done": "Complete",
    "closed": "Complete",
    "cancelled": "Cancelled",
    "historical": "Complete"
  }
}
